{
  "claimsProfile": "eipc.session-token.v1",
  "issuer": "robothree.central.fixture",
  "audience": "robothree.enterprise-gateway",
  "enterpriseId": "enterprise.fixture",
  "userId": "user.fixture",
  "deviceId": "device.fixture-001",
  "clientInstanceId": "11111111-1111-4111-8111-111111111111",
  "tokenId": "44444444-4444-4444-8444-444444444444",
  "issuedAt": "2026-08-23T10:00:05.000Z",
  "expiresAt": "2026-08-23T10:15:00.000Z",
  "permissions": ["configuration.read", "personal_model.configure"],
  "sessionAssertionDigest": "sha256:cccccccccccccccccccccccccccccccccccccccccccccccccccccccccccccccc",
  "deviceTrustDecisionDigest": "sha256:eeeeeeeeeeeeeeeeeeeeeeeeeeeeeeeeeeeeeeeeeeeeeeeeeeeeeeeeeeeeeeee",
  "compatibilityRevision": "compatibility.fixture-001",
  "sourceDecisionDigest": "sha256:ffffffffffffffffffffffffffffffffffffffffffffffffffffffffffffffff"
}
